<?xml version="1.0" encoding="UTF-8"?>
<airplanes xmlns:xsi="http://www.w3.org/2001/XMLSchema-instance"
           xmlns="airplanes"
           xsi:schemaLocation="airplanes airplanes.xsd">
    <cargoairplane model="AN" origin="Russia">
        <price>150</price>
        <radar>true</radar>
        <parameters>
            <lengt>35</lengt>
            <width>16</width>
            <heigh>12</heigh>
        </parameters>
        <carigecapacity>125</carigecapacity>
    </cargoairplane>
    <passengerairplane model="Boing" origin="USA">
        <price>400</price>
        <radar>true</radar>
        <parameters>
            <lengt>100</lengt>
            <width>30</width>
            <heigh>25</heigh>
        </parameters>
        <capacity>225</capacity>
    </passengerairplane>
</airplanes>